{
  "entry": {
    "loop": {
      "Month": "На месяц",
      "Year": "На год"
    },
    "message": {
      "DeleteConfirm": "Вы действительно хотите удалить данный бюджет?",
      "DeleteConfirmOldNotice": "Этот бюджет связан со старым бюджетом. Если Вы его удалите, а затем кто-либо изменит старый бюджет (на старой веб-версии или в приложении со старым бюджетом), то автоматически создастся новый бюджет вместо этого."
    },
    "property": {
      "Loop": "Период",
      "Name": "Название"
    },
    "title": {
      "Create": "Добавить бюджет",
      "Delete": "Удалить бюджет"
    },
    "type": {
      "Expense": "Расходы",
      "Income": "Доходы"
    },
    "validation": {
      "EndDateAfterStartDate": "Дата окончания должна быть позже даты начала."
    }
  },
  "page": {
    "label": {
      "Budgets": "Бюджеты",
      "Category": "Категория",
      "Difference": "Разница",
      "ExpensesByCategories": "Расходы по категориям бюджета:",
      "Fact": "Факт",
      "IncomesByCategories": "Доходы по категориям бюджета:",
      "Plan": "План",
      "Progress": "Выполнение"
    },
    "Title": "Бюджет"
  },
  "period": {
    "property": {
      "Inherit": "Для всех будущих дат"
    }
  },
  "timeline": {
    "label": {
      "ShowAllCategories": "Показать все"
    }
  }
}
